<?xml version="1.0" encoding="utf-8"?>

<ScriptCanvas Include="Include/ScriptCanvas/Libraries/Time/RepeaterNodeable.h" xmlns:xsi="http://www.w3.org/2001/XMLSchema-instance"
			  xsi:noNamespaceSchemaLocation="../../AutoGen/ScriptCanvasNodeable.xsd">
    <Class Name="RepeaterNodeable"
        QualifiedName="ScriptCanvas::Nodeables::Core::RepeaterNodeable"
        PreferredClassName="Repeater"
        Uuid="{4FBB5021-F3C8-E743-BF2E-BC6E5D57D48E}"
        Base="Nodeables::Time::BaseTimer"
        Category="Timing"
        Namespace="ScriptCanvas"
        Description="Repeats the output signal the given number of times using the specified delay to space the signals out.">

        <!-- Input tag is for an execution input that has optional data (parameters) -->
        <Input Name="Start" Description="">
            <Parameter Name="Repetitions" Type="Data::NumberType" DefaultValue="0.0" Description="How many times to repeat."/>
            <Parameter Name="Interval" Type="Data::NumberType" DefaultValue="0.0" Description="The Interval between repetitions. If zero, all repititions execute immediately, before On Start"/>
        </Input>

        <Output Name="Complete" Description="Signaled upon node exit"/>
        <Output Name="Action" Description="Signaled every repetition"/>

        <PropertyInterface Property="m_timeUnitsInterface" Name="Units" Type="Input" Description="Units to represent the time in."/>
    </Class>
</ScriptCanvas>
